ID,Title,Link,Source,Published,Author,Summary
426,Topuria KO’s Oliveira to win lightweight title at UFC 317,https://www.aljazeera.com/sports/2025/6/29/topuria-beats-oliveira-to-win-ufc-lightweight-title-with-stunning-knockout,Al Jazeera Sports,,,
514,Norris wins Austrian GP; reduces Piastri’s F1 title lead,https://www.aljazeera.com/sports/2025/6/29/austrian-gp-norris-reduces-mclaren-teammate-piastris-title-lead,Al Jazeera Sports,,,
515,Gauff and Sabalenka team up in viral TikTok dance before Wimbledon,https://www.aljazeera.com/sports/2025/6/29/gauff-and-sabalenka-team-up-in-viral-tiktok-dance-before-wimbledon,Al Jazeera Sports,,,
516,Chelsea beat Benfica to reach FIFA Club World Cup quarterfinal,https://www.aljazeera.com/sports/2025/6/29/chelsea-beat-benfica-to-reach-fifa-club-world-cup-quarterfinal,Al Jazeera Sports,,,
383,Severe heat waves hit southern Europe as local authorities warn against wildfire risks,https://edition.cnn.com/2025/06/29/europe/heatwave-wildfire-southern-europe-intl-latam,CNN,2025-06-29 23:39:40.620882,,
384,Russia’s summer offensive in Ukraine underwhelms – but Kyiv won’t be celebrating,https://edition.cnn.com/2025/06/29/europe/russia-summer-offensive-kyiv-ukraine-intl,CNN,2025-06-29 23:39:40.623322,,
385,"European champion PSG knocks out Lionel Messi, Inter Miami in convincing fashion to advance to Club World Cup quarterfinal",https://edition.cnn.com/2025/06/29/sport/psg-eliminates-lionel-messi-inter-miami-club-world-cup-spt,CNN,2025-06-29 23:39:40.630496,,
386,Big crowds gather in Hungarian capital to defy ban on Budapest Pride,https://edition.cnn.com/2025/06/28/europe/budapest-pride-intl,CNN,2025-06-29 23:39:40.633547,,
387,Police clash with anti-government protesters calling for early elections in Serbia,https://edition.cnn.com/2025/06/28/europe/police-clash-protesters-elections-serbia-latam-intl,CNN,2025-06-29 23:39:40.636005,,
388,Bezos wedding protesters demand the billionaire ‘get out of our lagoon’,https://edition.cnn.com/2025/06/28/europe/jeff-bezos-wedding-protest-venice-latam-intl,CNN,2025-06-29 23:39:40.639414,,
389,Venice’s most guarded secret: Inside the Bezos-Sanchez wedding plans,https://edition.cnn.com/2025/06/23/style/venice-secret-bezos-sanchez-wedding-plans,CNN,2025-06-29 23:39:40.642691,,
390,You are cordially invited to critique Jeff Bezos and Lauren Sanchez’s wedding invitation,https://edition.cnn.com/2025/06/25/style/wedding-invite-leak-bezos-sanchez,CNN,2025-06-29 23:39:40.646355,,
391,"At the Bezos-Sanchez wedding: Bride, groom and VIP guests gather on San Giorgio Maggiore for the main event",https://edition.cnn.com/2025/06/26/style/bezos-sanchez-wedding-guests-arrive,CNN,2025-06-29 23:39:40.650178,,
392,Venice expects to rake in over $1.1 billion from Bezos-Sanchez wedding,https://edition.cnn.com/2025/06/27/business/venice-tourism-economy-bezos-wedding,CNN,2025-06-29 23:39:40.653863,,
393,Rachel Zegler is serenading crowds of people in central London almost every night for free,https://edition.cnn.com/2025/06/27/entertainment/rachel-zegler-evita-london-palladium-intl-scli,CNN,2025-06-29 23:39:40.656418,,
394,They call it ‘Merzcron’: The EU’s Franco-German engine is powering up once again,https://edition.cnn.com/2025/06/26/world/france-germany-alliance-merzcron-intl-cmd,CNN,2025-06-29 23:39:40.659777,,
395,Denmark plans to thwart deepfakers by giving everyone copyright over their own features,https://edition.cnn.com/2025/06/27/business/denmark-ai-law-scli-intl,CNN,2025-06-29 23:39:40.663562,,
396,Oslo police announce rape and sexual assault charges against son of Norwegian crown princess,https://edition.cnn.com/2025/06/27/europe/norway-police-royals-rape-charges-intl,CNN,2025-06-29 23:39:40.668678,,
374,How to Source and Use AI Training Datasets to Build Smarter Models,https://www.promptcloud.com/blog/how-to-source-ai-datasets/,PromptCloud,2025-06-26 00:00:00,Bhagyashree,
375,Why Vector Databases Are Essential for LLMs and AI Models,https://www.promptcloud.com/blog/how-to-use-vector-databases-for-ai-models/,PromptCloud,2025-06-24 00:00:00,Bhagyashree,
376,Data Analytics in the Fashion Industry: From Trend Forecasting to Market Success,https://www.promptcloud.com/blog/web-scraping-for-fashion-analytics/,PromptCloud,2025-06-23 00:00:00,Bhagyashree,
377,Build vs Buy: Choosing the Right Strategy for Data Acquisition,https://www.promptcloud.com/blog/build-vs-buy-for-data-acquisition/,PromptCloud,2025-06-20 00:00:00,Bhagyashree,
378,Screen Scraping: The Legal Landscape and Ethical Boundaries You Need to Know,https://www.promptcloud.com/blog/is-screen-scraping-legal/,PromptCloud,2025-06-19 00:00:00,Bhagyashree,
379,Building a Facebook Scraper in Python: Scraping Facebook Marketplace Data the Smart Way,https://www.promptcloud.com/blog/python-facebook-scraper/,PromptCloud,2025-06-17 00:00:00,Bhagyashree,
380,How Cars Data & Analytics Drives the Automobile Industry Forward,https://www.promptcloud.com/blog/car-data-analytics-with-web-scraping/,PromptCloud,2025-06-16 00:00:00,Bhagyashree,
381,"Scraping Google News Like a Pro: Ethical, Efficient, and Effective Techniques You Need to Know",https://www.promptcloud.com/blog/scrape-google-news/,PromptCloud,2025-06-13 00:00:00,Bhagyashree,
382,"Why Perplexity AI Isn’t Your Best Bet for Web Scraping: Risks, Gaps & Better Alternatives",https://www.promptcloud.com/blog/perplexity-ai-vs-web-scraping-services/,PromptCloud,2025-06-12 00:00:00,Bhagyashree,
397,Germany charges Syrian juvenile over foiled attack on Taylor Swift concert,https://edition.cnn.com/2025/06/27/europe/germany-syrian-arrest-taylor-swift-intl,CNN,2025-06-29 23:39:40.672724,,
398,On GPS: Jake Sullivan says allies are trying to ‘de-risk’ from the US,https://edition.cnn.com/2025/06/29/world/video/gps0629-trump-allies-russia-ukraine,CNN,2025-06-29 23:39:40.676617,,
399,Bezos’ Blue Origin company launches 13th human flight to space,https://edition.cnn.com/2025/06/29/science/video/jeff-bezos-blue-origin-new-shepard-ns-33-launch-digvid,CNN,2025-06-29 23:39:40.682827,,
400,Thousands defy ban on Budapest Pride,https://edition.cnn.com/2025/06/28/world/video/budapest-pride-ban-protests-hungary-orban-digvid,CNN,2025-06-29 23:39:40.687405,,
401,Newlyweds Jeff Bezos and Lauren Sanchez spotted on Venice boat ride,https://edition.cnn.com/2025/06/28/style/video/bezos-sanchez-wedding-boat-ride-venice-melissa-bell-digvid,CNN,2025-06-29 23:39:40.690384,,
402,See Lauren Sanchez leaving the Aman hotel ahead of her wedding to Jeff Bezos,https://edition.cnn.com/2025/06/27/style/video/bezos-wedding-sanchez-blows-kiss-ldn-digvid,CNN,2025-06-29 23:39:40.693248,,
403,Here’s what we know ahead of the Bezos-Sanchez wedding,https://edition.cnn.com/2025/06/27/style/video/bezos-sanchez-wedding-summary-bell-ldn-digvid,CNN,2025-06-29 23:39:40.696797,,
404,‘No space for Bezos’ projected with laser on Venice building,https://edition.cnn.com/2025/06/26/world/video/no-space-for-bezos-projected-with-laser-in-venice-digvid,CNN,2025-06-29 23:39:40.699871,,
405,"Oprah, Gates, Kardashians…First day of Bezos wedding weekend well underway",https://edition.cnn.com/2025/06/26/style/video/jeff-bezos-wedding-weekend-venice-digvid,CNN,2025-06-29 23:39:40.702754,,
406,"Kylian Mbappé sues PSG, accusing former club of ‘moral harassment’",https://edition.cnn.com/2025/06/26/sport/kylian-mbappe-sues-psg-spt-intl,CNN,2025-06-29 23:39:40.705004,,
407,Lyon relegated to French soccer’s second tier amid ongoing financial problems,https://edition.cnn.com/2025/06/24/sport/lyon-relegated-amid-financial-problems-spt,CNN,2025-06-29 23:39:40.707257,,
408,Lionel Messi to face former team PSG in Club World Cup round of 16 after Inter Miami progresses from group stage,https://edition.cnn.com/2025/06/24/sport/messi-inter-miami-psg-club-world-cup-knockouts-spt,CNN,2025-06-29 23:39:40.709135,,
409,A Dior debut and a fresh female perspective: What to watch at Paris Fashion Week Men’s,https://edition.cnn.com/2025/06/24/style/dior-debut-paris-fashion-week-mens,CNN,2025-06-29 23:39:40.711555,,
410,145 people pricked with syringes at France street music festival,https://edition.cnn.com/2025/06/23/europe/france-festival-syringe-attacks-intl-scli,CNN,2025-06-29 23:39:40.714755,,
411,Germany scraps funding for sea rescues of migrants,https://edition.cnn.com/2025/06/26/europe/germany-migrants-sea-rescue-funding-intl-latam,CNN,2025-06-29 23:39:40.717895,,
412,"Who is Florian Wirtz, the $156 million man joining Liverpool?",https://edition.cnn.com/2025/06/20/sport/florian-wirtz-liverpool-transfer-spt-intl,CNN,2025-06-29 23:39:40.720221,,
413,A brief history on hot dogs,https://edition.cnn.com/2020/07/03/travel/video/hot-dog-nathans-coney-island-travel-orig,CNN,2025-06-29 23:39:40.723191,,
414,Alex Zverev reaches second round in Halle after coming to aid of injured spectator,https://edition.cnn.com/2025/06/19/sport/alex-zverev-halle-aids-injured-spectator-spt-intl,CNN,2025-06-29 23:39:40.726609,,
415,"The UK, Germany and Canada have slashed foreign aid this year, deepening damage done by US cuts, analysis shows",https://edition.cnn.com/2025/06/12/europe/foreign-aid-cuts-uk-germany-canada-intl,CNN,2025-06-29 23:39:40.729603,,
416,"North Korea just opened a beach resort for 20,000 people. But who will visit?",https://edition.cnn.com/2025/06/26/travel/north-korea-kalma-beach-resort-tourism-intl-hnk,CNN,2025-06-29 23:39:40.733149,,
417,The latest pretrial developments in the Idaho student killings case,https://edition.cnn.com/2024/05/30/us/kohberger-idaho-killings-pretrial-hearings,CNN,2025-06-29 23:39:40.735415,,
418,"North Korea just opened a beach resort for 20,000 people",https://edition.cnn.com/2025/06/26/travel/video/north-korea-waterpark-beach-resort-ldn-digvid,CNN,2025-06-29 23:39:40.738069,,
419,Four astronauts launch to the space station as NASA grapples with strange twist in leak issue,https://edition.cnn.com/2025/06/25/science/axiom-space-iss-leak-zvezda-module,CNN,2025-06-29 23:39:40.739950,,
420,Trump says Putin called him to ask if he needed help with Iran,https://edition.cnn.com/2025/06/24/world/video/trump-putin-iran-help-digvid,CNN,2025-06-29 23:39:40.741839,,
421,Ukraine loses an F-16 pilot and his jet while fighting one of Russia’s biggest ever aerial attacks,https://edition.cnn.com/2025/06/29/europe/ukraine-f-16-pilot-killed-russia,CNN,2025-06-29 23:39:40.744236,,
422,"Russia has amassed 110,000 troops near strategic Ukrainian city, Kyiv says",https://edition.cnn.com/2025/06/27/world/pokrovsk-russia-ukraine-war-troops-intl,CNN,2025-06-29 23:39:40.747593,,
423,Inside the NATO charm offensive that shocked as much as it delivered,https://edition.cnn.com/2025/06/25/europe/rutte-daddy-trump-nato-ukraine-intl-latam,CNN,2025-06-29 23:39:40.750361,,
424,"US got ‘absolutely nothing in return’ for appeasing Putin, says former Swedish PM",https://edition.cnn.com/2025/06/26/Tv/video/amanpour-carl-bildt,CNN,2025-06-29 23:39:40.753005,,
425,Zelensky and European rights body establish tribunal to allow prosecution of Russian leaders,https://edition.cnn.com/2025/06/26/europe/zelensky-ukraine-special-tribunal-intl,CNN,2025-06-29 23:39:40.755867,,
